{
  "actor_id": "tool:sol_query_engine",
  "assurance": {
    "depends_on": [
      "records"
    ],
    "effective_status": "validated",
    "evidence": [
      "object:sha256:f83182d7d2d349fd82e7e6bf1e7b6dcae1575e421dfa17fbf624d3f30e635337"
    ],
    "status": "validated"
  },
  "continuation": null,
  "guarantee": {
    "kind": "exact",
    "result_object": "object:sha256:8c7cf6c168ede119934610c752029a6e147f172928e1341f8d0b0e5b05e470eb"
  },
  "logical_rewrites": [],
  "provenance_mode": "tuple",
  "query_digest": "digest:sha256:e5b02773421adcb3f2ad7fe6d3b33abd380ba6e7994197be7ea0de331ceeb88a",
  "query_ref": "record:query_solqry-record-census",
  "query_run_id": "qrun:corpus:PATH-001",
  "resource_usage": {
    "object_bytes_read": 0,
    "records_read": 5,
    "semantic_evaluations": 0,
    "wall_time_ms": 0
  },
  "rows_returned": 5,
  "schema_version": "qry.execution.v0.3",
  "source_manifest": "object:sha256:f83182d7d2d349fd82e7e6bf1e7b6dcae1575e421dfa17fbf624d3f30e635337",
  "status": "complete"
}
