{
  "actor_id": "tool:sol_query_engine",
  "assurance": {
    "depends_on": [
      "records"
    ],
    "effective_status": "validated",
    "evidence": [
      "object:sha256:5e3d905b176ffa601c4ba91e04dd770e7174ae8be0c74c4c0aabe9f056e169fd"
    ],
    "status": "validated"
  },
  "continuation": null,
  "guarantee": {
    "kind": "exact",
    "result_object": "object:sha256:8c7cf6c168ede119934610c752029a6e147f172928e1341f8d0b0e5b05e470eb"
  },
  "logical_rewrites": [],
  "provenance_mode": "tuple",
  "query_digest": "digest:sha256:c7fcc1954edc771f842895a7d883617720f2d03a92dabb7eddc96fc00b3abfdf",
  "query_ref": "record:query_solqry-record-census",
  "query_run_id": "qrun:corpus:GOLD-01",
  "resource_usage": {
    "object_bytes_read": 0,
    "records_read": 5,
    "semantic_evaluations": 0,
    "wall_time_ms": 0
  },
  "rows_returned": 5,
  "schema_version": "qry.execution.v0.3",
  "source_manifest": "object:sha256:5e3d905b176ffa601c4ba91e04dd770e7174ae8be0c74c4c0aabe9f056e169fd",
  "status": "complete"
}
