{
  "actor_id": "tool:sol_query_engine",
  "assurance": {
    "depends_on": [
      "records"
    ],
    "effective_status": "validated",
    "evidence": [
      "object:sha256:bb7a2164e08425a89973b8425ec3b9202e8eb55f1766b38a5527c9f6592ba448"
    ],
    "status": "validated"
  },
  "continuation": null,
  "guarantee": {
    "kind": "exact",
    "result_object": "object:sha256:8c7cf6c168ede119934610c752029a6e147f172928e1341f8d0b0e5b05e470eb"
  },
  "logical_rewrites": [],
  "provenance_mode": "tuple",
  "query_digest": "digest:sha256:8593b3852cd23c106c4b5c45bac7bef0e2020617d129dd371fbb75973a18ac2a",
  "query_ref": "record:query_solqry-record-census",
  "query_run_id": "qrun:sol_validator_corpus:PATH-008",
  "resource_usage": {
    "object_bytes_read": 0,
    "records_read": 5,
    "semantic_evaluations": 0,
    "wall_time_ms": 0
  },
  "rows_returned": 5,
  "schema_version": "qry.execution.v0.3",
  "source_manifest": "object:sha256:bb7a2164e08425a89973b8425ec3b9202e8eb55f1766b38a5527c9f6592ba448",
  "status": "complete"
}
