{
  "actor_id": "tool:sol_query_engine",
  "assurance": {
    "depends_on": [
      "records"
    ],
    "effective_status": "validated",
    "evidence": [
      "object:sha256:8df292bc8196e4e7862c788f4209746e3808d071da3bb0ad8f996383cd7229a2"
    ],
    "status": "validated"
  },
  "continuation": null,
  "guarantee": {
    "kind": "exact",
    "result_object": "object:sha256:1fb8001239d4b47505bebd7acb5d66ba846d381f51738e7960629531325691ad"
  },
  "logical_rewrites": [],
  "provenance_mode": "tuple",
  "query_digest": "digest:sha256:d5d805db14780ef30fba2b8317b091bef9b055c4caaa0801451be01ccd3f6b38",
  "query_ref": "record:query_solqry-record-census",
  "query_run_id": "qrun:sol_validator_corpus:PATH-025",
  "resource_usage": {
    "object_bytes_read": 0,
    "records_read": 6,
    "semantic_evaluations": 0,
    "wall_time_ms": 0
  },
  "rows_returned": 6,
  "schema_version": "qry.execution.v0.3",
  "source_manifest": "object:sha256:8df292bc8196e4e7862c788f4209746e3808d071da3bb0ad8f996383cd7229a2",
  "status": "complete"
}
