{
  "actor_id": "tool:sol_query_engine",
  "assurance": {
    "depends_on": [
      "records"
    ],
    "effective_status": "validated",
    "evidence": [
      "object:sha256:db06d25f70d7b08c951756767abc43b1379312ca9a17597826aefeb2b132e303"
    ],
    "status": "validated"
  },
  "continuation": null,
  "guarantee": {
    "kind": "exact",
    "result_object": "object:sha256:8c7cf6c168ede119934610c752029a6e147f172928e1341f8d0b0e5b05e470eb"
  },
  "logical_rewrites": [],
  "provenance_mode": "tuple",
  "query_digest": "digest:sha256:560733f5e499a196de2eacd51bc5b365fe97c28b92271553581c11abdceaa57f",
  "query_ref": "record:query_solqry-record-census",
  "query_run_id": "qrun:sol_validator_corpus:PATH-024",
  "resource_usage": {
    "object_bytes_read": 0,
    "records_read": 5,
    "semantic_evaluations": 0,
    "wall_time_ms": 0
  },
  "rows_returned": 5,
  "schema_version": "qry.execution.v0.3",
  "source_manifest": "object:sha256:db06d25f70d7b08c951756767abc43b1379312ca9a17597826aefeb2b132e303",
  "status": "complete"
}
