{
  "actor_id": "tool:sol_query_engine",
  "assurance": {
    "depends_on": [
      "records"
    ],
    "effective_status": "validated",
    "evidence": [
      "object:sha256:b908dd1318c2aaa1269b2aba287a156ad8c9a1d58248b9bf23b7cf750b5ee506"
    ],
    "status": "validated"
  },
  "continuation": null,
  "guarantee": {
    "kind": "exact",
    "result_object": "object:sha256:e9b801c63e718724e7d0bbd3f0a3e370c6eee622ddfe639a0ab519a5e8d705b8"
  },
  "logical_rewrites": [],
  "provenance_mode": "tuple",
  "query_digest": "digest:sha256:a6c7c8cc3f2dc6b5c3f8d4ffacbcd7aa93a541eb7f12087c1864d93277f210f9",
  "query_ref": "record:query_solqry-record-census",
  "query_run_id": "qrun:sol_validator_corpus:PATH-015",
  "resource_usage": {
    "object_bytes_read": 0,
    "records_read": 4,
    "semantic_evaluations": 0,
    "wall_time_ms": 0
  },
  "rows_returned": 4,
  "schema_version": "qry.execution.v0.3",
  "source_manifest": "object:sha256:b908dd1318c2aaa1269b2aba287a156ad8c9a1d58248b9bf23b7cf750b5ee506",
  "status": "complete"
}
