{
  "actor_id": "tool:sol_query_engine",
  "assurance": {
    "depends_on": [
      "records"
    ],
    "effective_status": "validated",
    "evidence": [
      "object:sha256:2a177daed32bcc157f438d5a0f0f07129d057a7ffe909d20471f738626e96bd1"
    ],
    "status": "validated"
  },
  "continuation": null,
  "guarantee": {
    "kind": "exact",
    "result_object": "object:sha256:1225a6a4bdb7910ff13bc2e399a0f00401a5935bf8ca16ec0319361e3a1c7e13"
  },
  "logical_rewrites": [],
  "provenance_mode": "tuple",
  "query_digest": "digest:sha256:0234002ddc8be3df1247f93bda141faf2e463ef7da74e1f896944abe6efcb866",
  "query_ref": "record:query_solqry-record-census",
  "query_run_id": "qrun:sol_validator_corpus:GOLD-02",
  "resource_usage": {
    "object_bytes_read": 0,
    "records_read": 6,
    "semantic_evaluations": 0,
    "wall_time_ms": 0
  },
  "rows_returned": 6,
  "schema_version": "qry.execution.v0.3",
  "source_manifest": "object:sha256:2a177daed32bcc157f438d5a0f0f07129d057a7ffe909d20471f738626e96bd1",
  "status": "complete"
}
