{
  "actor_id": "tool:sol_query_engine",
  "assurance": {
    "depends_on": [
      "records"
    ],
    "effective_status": "validated",
    "evidence": [
      "object:sha256:47fc0fa3119505c091c0f9b626e076fdb94f2b515581414d8044a117489da99f"
    ],
    "status": "validated"
  },
  "continuation": null,
  "guarantee": {
    "kind": "exact",
    "result_object": "object:sha256:8c7cf6c168ede119934610c752029a6e147f172928e1341f8d0b0e5b05e470eb"
  },
  "logical_rewrites": [],
  "provenance_mode": "tuple",
  "query_digest": "digest:sha256:c611dc2551cc891245b220503d50ffa680bd06e23b5db2de5c2deb33856f948d",
  "query_ref": "record:query_solqry-record-census",
  "query_run_id": "qrun:corpus:PATH-020",
  "resource_usage": {
    "object_bytes_read": 0,
    "records_read": 5,
    "semantic_evaluations": 0,
    "wall_time_ms": 0
  },
  "rows_returned": 5,
  "schema_version": "qry.execution.v0.3",
  "source_manifest": "object:sha256:47fc0fa3119505c091c0f9b626e076fdb94f2b515581414d8044a117489da99f",
  "status": "complete"
}
