{
  "actor_id": "tool:sol_query_engine",
  "assurance": {
    "depends_on": [
      "records"
    ],
    "effective_status": "validated",
    "evidence": [
      "object:sha256:be5dbf4d6092962456ab444d1866cf11797d970fc5964ab7d610ad51a5aa40ad"
    ],
    "status": "validated"
  },
  "continuation": null,
  "guarantee": {
    "kind": "exact",
    "result_object": "object:sha256:0822b1b64a7023166554aa9a96ee7186790103a4be9256798b162c4fc482d6d8"
  },
  "logical_rewrites": [],
  "provenance_mode": "tuple",
  "query_digest": "digest:sha256:96cc77c2321dd6b8c6d9d0ad2e1e4398eb2066da0600d8d6ee4b37f8025a5b31",
  "query_ref": "record:query_solqry-record-census",
  "query_run_id": "qrun:corpus:PATH-022",
  "resource_usage": {
    "object_bytes_read": 0,
    "records_read": 7,
    "semantic_evaluations": 0,
    "wall_time_ms": 0
  },
  "rows_returned": 7,
  "schema_version": "qry.execution.v0.3",
  "source_manifest": "object:sha256:be5dbf4d6092962456ab444d1866cf11797d970fc5964ab7d610ad51a5aa40ad",
  "status": "complete"
}
