{
  "actor_id": "tool:sol_query_engine",
  "assurance": {
    "depends_on": [
      "records"
    ],
    "effective_status": "validated",
    "evidence": [
      "object:sha256:b0454f1b787883004d70f3dd095adfd087474addb8c371f1a5e0cf74cb6c4513"
    ],
    "status": "validated"
  },
  "continuation": null,
  "guarantee": {
    "kind": "exact",
    "result_object": "object:sha256:0822b1b64a7023166554aa9a96ee7186790103a4be9256798b162c4fc482d6d8"
  },
  "logical_rewrites": [],
  "provenance_mode": "tuple",
  "query_digest": "digest:sha256:a05aab234e618c02462412bf8acdeb16845702871079a399f0a7563a9d800485",
  "query_ref": "record:query_solqry-record-census",
  "query_run_id": "qrun:corpus:PATH-010",
  "resource_usage": {
    "object_bytes_read": 0,
    "records_read": 7,
    "semantic_evaluations": 0,
    "wall_time_ms": 0
  },
  "rows_returned": 7,
  "schema_version": "qry.execution.v0.3",
  "source_manifest": "object:sha256:b0454f1b787883004d70f3dd095adfd087474addb8c371f1a5e0cf74cb6c4513",
  "status": "complete"
}
