{
  "actor_id": "tool:sol_query_engine",
  "assurance": {
    "depends_on": [
      "records"
    ],
    "effective_status": "validated",
    "evidence": [
      "object:sha256:74358cf6e53e1d7d12e44940d6ebd056dfada7091a05003b68e5e5375f958fe7"
    ],
    "status": "validated"
  },
  "continuation": null,
  "guarantee": {
    "kind": "exact",
    "result_object": "object:sha256:8c7cf6c168ede119934610c752029a6e147f172928e1341f8d0b0e5b05e470eb"
  },
  "logical_rewrites": [],
  "provenance_mode": "tuple",
  "query_digest": "digest:sha256:729b3827d9c01c7fbfc75d58f6a92b072c1778cb7734b854124c9d106b5ced3d",
  "query_ref": "record:query_solqry-record-census",
  "query_run_id": "qrun:corpus:PATH-013",
  "resource_usage": {
    "object_bytes_read": 0,
    "records_read": 5,
    "semantic_evaluations": 0,
    "wall_time_ms": 0
  },
  "rows_returned": 5,
  "schema_version": "qry.execution.v0.3",
  "source_manifest": "object:sha256:74358cf6e53e1d7d12e44940d6ebd056dfada7091a05003b68e5e5375f958fe7",
  "status": "complete"
}
