{
  "actor_id": "tool:sol_query_engine",
  "assurance": {
    "depends_on": [
      "records"
    ],
    "effective_status": "validated",
    "evidence": [
      "object:sha256:bc5f87d5ba081797b1a621d9b7574e252444727aed3d225efa140b7a203dd255"
    ],
    "status": "validated"
  },
  "continuation": null,
  "guarantee": {
    "kind": "exact",
    "result_object": "object:sha256:8c7cf6c168ede119934610c752029a6e147f172928e1341f8d0b0e5b05e470eb"
  },
  "logical_rewrites": [],
  "provenance_mode": "tuple",
  "query_digest": "digest:sha256:c90e07df3f04ca5fec2e28f649b0219227858ddf335a067da26778c2ff916730",
  "query_ref": "record:query_QGOLD-001",
  "query_run_id": "qrun:corpus:QGOLD-001",
  "resource_usage": {
    "object_bytes_read": 0,
    "records_read": 5,
    "semantic_evaluations": 0,
    "wall_time_ms": 0
  },
  "rows_returned": 5,
  "schema_version": "qry.execution.v0.3",
  "source_manifest": "object:sha256:bc5f87d5ba081797b1a621d9b7574e252444727aed3d225efa140b7a203dd255",
  "status": "complete"
}
