{
  "actor_id": "tool:sol_query_engine",
  "assurance": {
    "depends_on": [
      "records"
    ],
    "effective_status": "validated",
    "evidence": [
      "object:sha256:2afe2d16648a8424230b099d312c5d864715ce09590f29ba0bea5fae2a20875c"
    ],
    "status": "validated"
  },
  "continuation": null,
  "guarantee": {
    "kind": "exact",
    "result_object": "object:sha256:0822b1b64a7023166554aa9a96ee7186790103a4be9256798b162c4fc482d6d8"
  },
  "logical_rewrites": [],
  "provenance_mode": "tuple",
  "query_digest": "digest:sha256:76d52dae4d7038cfe5ea4da8b17fd32a6909596c1417a06de6b1062430c1bab9",
  "query_ref": "record:query_solqry-record-census",
  "query_run_id": "qrun:sol_validator_corpus:PATH-010",
  "resource_usage": {
    "object_bytes_read": 0,
    "records_read": 7,
    "semantic_evaluations": 0,
    "wall_time_ms": 0
  },
  "rows_returned": 7,
  "schema_version": "qry.execution.v0.3",
  "source_manifest": "object:sha256:2afe2d16648a8424230b099d312c5d864715ce09590f29ba0bea5fae2a20875c",
  "status": "complete"
}
