{
  "actor_id": "tool:sol_query_engine",
  "assurance": {
    "depends_on": [
      "records"
    ],
    "effective_status": "validated",
    "evidence": [
      "object:sha256:3c24b928dfea547b39c55f0ab0bf080801768b31f979ab9127a085b304302df7"
    ],
    "status": "validated"
  },
  "continuation": null,
  "guarantee": {
    "kind": "exact",
    "result_object": "object:sha256:597ac503012712f0bad09c0583a064d37e1ec9d0bdf8bdd89ba19288b4f46821"
  },
  "logical_rewrites": [],
  "provenance_mode": "tuple",
  "query_digest": "digest:sha256:af1158362898e9e5c1a6d1ac49e6229d3a6aa3535bfcfb744aa939f6528c2ce4",
  "query_ref": "record:query_solqry-record-census",
  "query_run_id": "qrun:sol_validator_corpus:GOLD-05",
  "resource_usage": {
    "object_bytes_read": 0,
    "records_read": 6,
    "semantic_evaluations": 0,
    "wall_time_ms": 0
  },
  "rows_returned": 6,
  "schema_version": "qry.execution.v0.3",
  "source_manifest": "object:sha256:3c24b928dfea547b39c55f0ab0bf080801768b31f979ab9127a085b304302df7",
  "status": "complete"
}
